{
  "schema_version": 1,
  "job_type": "lora_finetune",
  "backend": "fsdp-ddp",
  "base_model_id": "reference-tiny-llm",
  "served_model_id": "reference-tiny-llm-lora-demo",
  "status": "completed",
  "adapter_dir": "training/results/lora-demo/adapter",
  "adapter_files": {
    "adapter_config": "adapter_config.json",
    "adapter_weights": "adapter_model.safetensors"
  },
  "lora": {
    "r": 4,
    "lora_alpha": 8,
    "target_modules": ["c_attn"]
  },
  "metrics": {
    "loss_curve": [
      { "step": 1, "loss": 8.5 },
      { "step": 2, "loss": 8.1 },
      { "step": 3, "loss": 7.8 },
      { "step": 4, "loss": 7.5 }
    ],
    "final_loss": 7.5,
    "steps_completed": 4,
    "wall_clock_seconds": 12.0,
    "logits_delta_l1": 0.05
  },
  "cpu_dev_mode": true,
  "verification": "structural_not_sha256"
}
